{
  "$schema": "https://json-schema.org/draft/2020-12/schema",
  "$id": "https://sdp.dev/reality/conflicts-report/v1",
  "title": "RealityConflictsReport",
  "description": "Arbitrated disagreement report for reality-pro findings.",
  "type": "object",
  "required": [
    "spec_version",
    "generated_at",
    "conflicts"
  ],
  "properties": {
    "spec_version": {
      "type": "string",
      "pattern": "^v\\d+\\.\\d+$"
    },
    "generated_at": {
      "type": "string",
      "format": "date-time"
    },
    "conflicts": {
      "type": "array",
      "minItems": 1,
      "items": {
        "type": "object",
        "required": [
          "conflict_id",
          "summary",
          "competing_claim_ids",
          "severity",
          "status"
        ],
        "properties": {
          "conflict_id": {
            "type": "string",
            "minLength": 1
          },
          "summary": {
            "type": "string",
            "minLength": 1
          },
          "competing_claim_ids": {
            "type": "array",
            "minItems": 2,
            "items": {
              "type": "string",
              "minLength": 1
            }
          },
          "severity": {
            "type": "string",
            "enum": [
              "low",
              "medium",
              "high",
              "critical"
            ]
          },
          "status": {
            "type": "string",
            "enum": [
              "open",
              "triaged",
              "arbitrated"
            ]
          },
          "arbitrated_claim_id": {
            "type": "string"
          },
          "resolution_notes": {
            "type": "string"
          },
          "source_ids": {
            "type": "array",
            "items": {
              "type": "string",
              "minLength": 1
            }
          }
        },
        "additionalProperties": false
      }
    },
    "claims": {
      "type": "array",
      "items": {
        "$ref": "claim.schema.json"
      }
    },
    "sources": {
      "type": "array",
      "items": {
        "$ref": "source.schema.json"
      }
    }
  },
  "additionalProperties": false
}
